id,nivel_id,trilha,categoria,skill,nivel_esperado,detalhes,ordem
376,4,Cientista de Dados,Expertise Profunda,"Expert em domínio específico (NLP, Computer Vision, Recommender Systems, etc.)",,"Expert em domínio específico (NLP, Computer Vision, Recommender Systems, etc.)",
377,4,Cientista de Dados,Expertise Profunda,"Contribui para open source (libraries, papers)",,"Contribui para open source (libraries, papers)",
378,4,Cientista de Dados,Expertise Profunda,Referência técnica em ML/IA,,Referência técnica em ML/IA,
379,5,Cientista de Dados,Entregas Principais (Lead+),Define estratégia de ML/IA multi-ano,,Define estratégia de ML/IA multi-ano,
380,5,Cientista de Dados,Entregas Principais (Lead+),Influencia práticas de ML de múltiplos times,,Influencia práticas de ML de múltiplos times,
381,5,Cientista de Dados,Entregas Principais (Lead+),Cria capacidades que transformam o negócio,,Cria capacidades que transformam o negócio,
382,5,Cientista de Dados,ML Strategy,Define ML/IA roadmap de 2-3 anos,,Define **ML/IA roadmap** de 2-3 anos,
383,5,Cientista de Dados,ML Strategy,Identifica high-impact ML opportunities,,Identifica **high-impact ML opportunities**,
384,5,Cientista de Dados,ML Strategy,Avalia build vs buy vs API para ML capabilities,,Avalia **build vs buy vs API** para ML capabilities,
385,5,Cientista de Dados,ML Strategy,Alinha ML strategy com objetivos de negócio,,Alinha ML strategy com objetivos de negócio,
386,5,Cientista de Dados,Organizational ML Capabilities,Estabelece MLOps practices organizacionais,,Estabelece **MLOps practices** organizacionais,
387,5,Cientista de Dados,Organizational ML Capabilities,Define ML governance e responsible AI,,Define **ML governance** e **responsible AI**,
388,5,Cientista de Dados,Organizational ML Capabilities,Cria training programs para ML practitioners,,Cria **training programs** para ML practitioners,
389,5,Cientista de Dados,Organizational ML Capabilities,Implementa ML engineering standards,,Implementa **ML engineering standards**,
390,5,Cientista de Dados,Advanced GenAI,Define GenAI strategy para empresa,,Define **GenAI strategy** para empresa,
391,5,Cientista de Dados,Advanced GenAI,"Avalia LLM providers (OpenAI, Anthropic, Cohere)",,"Avalia **LLM providers** (OpenAI, Anthropic, Cohere)",
392,5,Cientista de Dados,Advanced GenAI,"Implementa LLM governance (cost, safety, privacy)",,"Implementa **LLM governance** (cost, safety, privacy)",
393,5,Cientista de Dados,Advanced GenAI,Cria GenAI use case framework,,Cria **GenAI use case framework**,
